Category Name,Category Description,Creation Date
Technology,"Topics related to the latest advancements, trends, and tools in technology.",2024-06-19
Health,"Health-related content, including wellness, medical research, and fitness.",2024-02-07
Finance,"Financial advice, market analysis, and economic trends.",2024-02-01
Education,"Educational resources, strategies, and news across all levels of learning.",2024-01-02
Business,"Business strategies, entrepreneurship, and corporate management.",2024-03-25
Entertainment,"Entertainment news, reviews, and discussions about movies, music, and more.",2024-01-19
Science,"Scientific discoveries, research, and discussions about various scientific fields.",2024-01-21
Environment,"Environmental issues, sustainability practices, and climate change.",2024-08-17
Politics,"Political analysis, news, and discussions about current events.",2024-03-19
Sports,"Updates, analysis, and discussions about various sports.",2024-07-16
Culture,"Explorations of cultural trends, art, literature, and heritage.",2024-01-01
Travel,"Travel tips, destination guides, and experiences from around the world.",2024-06-07
Lifestyle,"Content related to daily life, wellness, and personal interests.",2024-04-17
Food & Nutrition,"Discussions about food, nutrition, and healthy eating habits.",2024-04-12
Personal Development,"Guidance on personal growth, self-improvement, and achieving life goals.",2024-02-10
Productivity,"Tips, tools, and strategies for improving productivity in personal and professional life.",2024-05-02
Social Issues,"Content focusing on social issues, human rights, and community concerns.",2024-02-17
Marketing,"Marketing strategies, branding, and advertising trends.",2024-02-06
Artificial Intelligence,"Explorations of AI technologies, machine learning, and automation.",2024-03-07
Innovation,"Content about fostering innovation, creativity, and new ideas in various fields.",2024-08-19
